{
  "schema_version": "1.0.0",
  "theorem": {
    "id": "forge__swing_equation__rotor_speed_step__structural_class",
    "base_id": "forge__swing_equation__rotor_speed_step__structural_class",
    "variant_strategy": null,
    "statement": {
      "informal": "`rotor_speed_step` is structurally polynomial: chain order 0 implies the function lives in the polynomial regime of the EML hierarchy. This is a definitional consequence of `rotor_speed_step_chain_order`.",
      "formal_lean": "-- theorem rotor_speed_step_is_polynomial : is_polynomial rotor_speed_step := sorry",
      "formal_eml_lang": null
    },
    "domain": "forge_mined",
    "lane": 2,
    "tags": [
      "forge_mined",
      "file::swing_equation",
      "function::rotor_speed_step",
      "chain_order::0",
      "class::polynomial",
      "property::structural_class"
    ]
  },
  "proofs": [],
  "difficulty": {
    "lane": 2,
    "label": "beginner",
    "calibrated_from_attempts": 0,
    "average_hint_level_at_solve": 0.0,
    "prerequisite_skills": [
      "chain_order_definition"
    ]
  },
  "common_mistakes": [],
  "tactic_trace": {
    "successful": {},
    "failed": {},
    "success_rate_by_tactic": {}
  },
  "structural_profile": {
    "chain_order": 0,
    "cost_class": null,
    "eml_depth": null,
    "dynamics": {
      "oscillations": 0,
      "decays": 0
    },
    "drift_risk": "LOW",
    "fpga_estimate": {
      "cycles": 8,
      "mac_units": 4,
      "trig_units": 0
    }
  },
  "relationships": {
    "parent": null,
    "siblings": [],
    "depends_on": [],
    "structural_siblings": []
  },
  "metadata": {
    "verified": false,
    "verification_method": "pending",
    "generated_by": "from_forge_importer_v1",
    "creation_date": "2026-05-01",
    "source_eml_file": "D:/monogate-forge/industries/energy/power_grid/swing_equation.eml",
    "source_function": "rotor_speed_step"
  }
}