{
  "schema_version": "1.0.0",
  "theorem": {
    "id": "SB_sub_ge_two_negation_1",
    "base_id": "SB_sub_ge_two",
    "variant_strategy": "negation",
    "statement": {
      "informal": "NEGATION of: SuperBEST lower bound for subtraction: SB(−) ≥ 2 nodes. No single F16 operator computes subtraction over all real x, y — established by destructuring an existential and citing the omnibus 16-case lemma.",
      "formal_lean": "theorem SB_sub_ge_two : ¬ (¬ one_node_computable_sub (· - ·))",
      "formal_eml_lang": null
    },
    "domain": "eml",
    "lane": 4,
    "tags": [
      "negation",
      "generated",
      "lane-4"
    ]
  },
  "proofs": [
    {
      "id": "p1",
      "tactics": [
        "by sorry"
      ],
      "tactic_count": 1,
      "eml_node_cost": 0,
      "style": "definitional",
      "is_optimal": true,
      "discovered_by": "machlib_generator_v1",
      "discovery_date": "2026-04-30"
    }
  ],
  "difficulty": {
    "lane": 4,
    "label": "advanced",
    "calibrated_from_attempts": 0,
    "average_hint_level_at_solve": 0.0,
    "prerequisite_skills": []
  },
  "common_mistakes": [],
  "tactic_trace": {
    "successful": {},
    "failed": {},
    "success_rate_by_tactic": {}
  },
  "structural_profile": {
    "chain_order": null,
    "cost_class": null,
    "eml_depth": null,
    "dynamics": {
      "oscillations": 0,
      "decays": 0
    },
    "drift_risk": "LOW",
    "fpga_estimate": null
  },
  "relationships": {
    "parent": "SB_sub_ge_two",
    "siblings": [],
    "depends_on": [],
    "structural_siblings": []
  },
  "metadata": {
    "verified": false,
    "verification_method": null,
    "verification_pending": "Phase 1.5 — port legacy theorems to MachLib foundations before kernel re-verification.",
    "generated_by": "machlib_generator_v1",
    "creation_date": "2026-04-30"
  }
}