{
  "schema_version": "1.0.0",
  "theorem": {
    "id": "forge__op_amp_inverting__magnitude_at_freq__verify_contract",
    "base_id": "forge__op_amp_inverting__magnitude_at_freq__verify_contract",
    "variant_strategy": null,
    "statement": {
      "informal": "`magnitude_at_freq` satisfies its @verify contract: under preconditions (g_dc_magnitude >= 0.0 ∧ g_dc_magnitude <= 1.0e6 ∧ frequency >= FREQ_MIN ∧ frequency <= FREQ_MAX ∧ bandwidth >= 1.0 ∧ bandwidth <= FREQ_MAX), the function's result satisfies (result >= 0.0). This is the obligation Forge ships to a Lean target for DO-178C / IEC-61508 / ISO-26262 certification evidence.",
      "formal_lean": "-- @verify obligation pulled from op_amp_inverting.eml\n-- theorem magnitude_rolloff_minus3db_at_bw : ∀ args, (g_dc_magnitude >= 0.0 ∧ g_dc_magnitude <= 1.0e6 ∧ frequency >= FREQ_MIN ∧ frequency <= FREQ_MAX ∧ bandwidth >= 1.0 ∧ bandwidth <= FREQ_MAX) → (result >= 0.0) := sorry",
      "formal_eml_lang": null
    },
    "domain": "forge_mined",
    "lane": 2,
    "tags": [
      "forge_mined",
      "file::op_amp_inverting",
      "function::magnitude_at_freq",
      "chain_order::1",
      "class::exponential",
      "property::contract",
      "contract::magnitude_rolloff_minus3db_at_bw"
    ]
  },
  "proofs": [],
  "difficulty": {
    "lane": 2,
    "label": "intermediate",
    "calibrated_from_attempts": 0,
    "average_hint_level_at_solve": 0.0,
    "prerequisite_skills": [
      "chain_order_definition",
      "exp_log_axioms",
      "hoare_contract_reasoning"
    ]
  },
  "common_mistakes": [],
  "tactic_trace": {
    "successful": {},
    "failed": {},
    "success_rate_by_tactic": {}
  },
  "structural_profile": {
    "chain_order": 1,
    "cost_class": null,
    "eml_depth": null,
    "dynamics": {
      "oscillations": 0,
      "decays": 1
    },
    "drift_risk": "LOW",
    "fpga_estimate": {
      "cycles": 10,
      "mac_units": 5,
      "trig_units": 0
    }
  },
  "relationships": {
    "parent": null,
    "siblings": [],
    "depends_on": [],
    "structural_siblings": []
  },
  "metadata": {
    "verified": false,
    "verification_method": "pending",
    "generated_by": "from_forge_importer_v1",
    "creation_date": "2026-05-01",
    "source_eml_file": "D:/monogate-forge/industries/semiconductor/op_amp_inverting.eml",
    "source_function": "magnitude_at_freq"
  }
}