{
  "schema_version": "1.0.0",
  "theorem": {
    "id": "forge__esc_yaw_rate__sideslip_rate__structural_class",
    "base_id": "forge__esc_yaw_rate__sideslip_rate__structural_class",
    "variant_strategy": null,
    "statement": {
      "informal": "`sideslip_rate` is structurally polynomial: chain order 0 implies the function lives in the polynomial regime of the EML hierarchy. This is a definitional consequence of `sideslip_rate_chain_order`.",
      "formal_lean": "-- theorem sideslip_rate_is_polynomial : is_polynomial sideslip_rate := sorry",
      "formal_eml_lang": null
    },
    "domain": "forge_mined",
    "lane": 2,
    "tags": [
      "forge_mined",
      "file::esc_yaw_rate",
      "function::sideslip_rate",
      "chain_order::0",
      "class::polynomial",
      "property::structural_class"
    ]
  },
  "proofs": [],
  "difficulty": {
    "lane": 2,
    "label": "beginner",
    "calibrated_from_attempts": 0,
    "average_hint_level_at_solve": 0.0,
    "prerequisite_skills": [
      "chain_order_definition"
    ]
  },
  "common_mistakes": [],
  "tactic_trace": {
    "successful": {},
    "failed": {},
    "success_rate_by_tactic": {}
  },
  "structural_profile": {
    "chain_order": 0,
    "cost_class": null,
    "eml_depth": null,
    "dynamics": {
      "oscillations": 0,
      "decays": 0
    },
    "drift_risk": "LOW",
    "fpga_estimate": {
      "cycles": 6,
      "mac_units": 3,
      "trig_units": 0
    }
  },
  "relationships": {
    "parent": null,
    "siblings": [],
    "depends_on": [],
    "structural_siblings": []
  },
  "metadata": {
    "verified": false,
    "verification_method": "pending",
    "generated_by": "from_forge_importer_v1",
    "creation_date": "2026-05-01",
    "source_eml_file": "<private>/esc_yaw_rate.eml",
    "source_function": "sideslip_rate"
  }
}
