{
  "schema_version": "1.0.0",
  "theorem": {
    "id": "forge__gamma_correct__srgb_to_linear__node_count",
    "base_id": "forge__gamma_correct__srgb_to_linear__node_count",
    "variant_strategy": null,
    "statement": {
      "informal": "`srgb_to_linear` compiles to 8 EML routing nodes after SuperBEST optimization. This is the canonical, minimal node count Forge produces for the function as written.",
      "formal_lean": "-- Pending MachLib infrastructure for forge function imports.\n-- theorem srgb_to_linear_node_count : node_count srgb_to_linear = 8 := sorry",
      "formal_eml_lang": null
    },
    "domain": "forge_mined",
    "lane": 2,
    "tags": [
      "forge_mined",
      "file::gamma_correct",
      "function::srgb_to_linear",
      "chain_order::1",
      "class::exponential",
      "property::node_count"
    ]
  },
  "proofs": [],
  "difficulty": {
    "lane": 2,
    "label": "intermediate",
    "calibrated_from_attempts": 0,
    "average_hint_level_at_solve": 0.0,
    "prerequisite_skills": [
      "chain_order_definition",
      "exp_log_axioms"
    ]
  },
  "common_mistakes": [],
  "tactic_trace": {
    "successful": {},
    "failed": {},
    "success_rate_by_tactic": {}
  },
  "structural_profile": {
    "chain_order": 1,
    "cost_class": null,
    "eml_depth": null,
    "dynamics": {
      "oscillations": 0,
      "decays": 1
    },
    "drift_risk": "LOW",
    "fpga_estimate": {
      "cycles": 6,
      "mac_units": 3,
      "trig_units": 0
    }
  },
  "relationships": {
    "parent": null,
    "siblings": [],
    "depends_on": [],
    "structural_siblings": []
  },
  "metadata": {
    "verified": false,
    "verification_method": "pending",
    "generated_by": "from_forge_importer_v1",
    "creation_date": "2026-05-01",
    "source_eml_file": "D:/monogate-forge/industries/imaging/gamma_correct.eml",
    "source_function": "srgb_to_linear"
  }
}