{
  "schema_version": "1.0.0",
  "theorem": {
    "id": "forge__aragonite_saturation__saturation_state__node_count",
    "base_id": "forge__aragonite_saturation__saturation_state__node_count",
    "variant_strategy": null,
    "statement": {
      "informal": "`saturation_state` compiles to 6 EML routing nodes after SuperBEST optimization. This is the canonical, minimal node count Forge produces for the function as written.",
      "formal_lean": "-- Pending MachLib infrastructure for forge function imports.\n-- theorem saturation_state_node_count : node_count saturation_state = 6 := sorry",
      "formal_eml_lang": null
    },
    "domain": "forge_mined",
    "lane": 2,
    "tags": [
      "forge_mined",
      "file::aragonite_saturation",
      "function::saturation_state",
      "chain_order::0",
      "class::polynomial",
      "property::node_count"
    ]
  },
  "proofs": [],
  "difficulty": {
    "lane": 2,
    "label": "beginner",
    "calibrated_from_attempts": 0,
    "average_hint_level_at_solve": 0.0,
    "prerequisite_skills": [
      "chain_order_definition"
    ]
  },
  "common_mistakes": [],
  "tactic_trace": {
    "successful": {},
    "failed": {},
    "success_rate_by_tactic": {}
  },
  "structural_profile": {
    "chain_order": 0,
    "cost_class": null,
    "eml_depth": null,
    "dynamics": {
      "oscillations": 0,
      "decays": 0
    },
    "drift_risk": "LOW",
    "fpga_estimate": {
      "cycles": 4,
      "mac_units": 2,
      "trig_units": 0
    }
  },
  "relationships": {
    "parent": null,
    "siblings": [],
    "depends_on": [],
    "structural_siblings": []
  },
  "metadata": {
    "verified": false,
    "verification_method": "pending",
    "generated_by": "from_forge_importer_v1",
    "creation_date": "2026-05-01",
    "source_eml_file": "<private>/aragonite_saturation.eml",
    "source_function": "saturation_state"
  }
}
