{
  "schema_version": "1.0.0",
  "theorem": {
    "id": "forge__particle_euler_step__velocity_step_with_drag__verify_contract",
    "base_id": "forge__particle_euler_step__velocity_step_with_drag__verify_contract",
    "variant_strategy": null,
    "statement": {
      "informal": "`velocity_step_with_drag` satisfies its @verify contract: under preconditions (dt >= 0.0 ∧ dt <= DT_MAX ∧ velocity >= -VEL_MAX ∧ velocity <= VEL_MAX ∧ acceleration >= -ACC_MAX ∧ acceleration <= ACC_MAX ∧ drag_coefficient >= 0.0 ∧ drag_coefficient <= DRAG_MAX), the function's result satisfies (True). This is the obligation Forge ships to a Lean target for DO-178C / IEC-61508 / ISO-26262 certification evidence.",
      "formal_lean": "-- @verify obligation pulled from euler_step.eml\n-- theorem euler_step_drag_decays_velocity : ∀ args, (dt >= 0.0 ∧ dt <= DT_MAX ∧ velocity >= -VEL_MAX ∧ velocity <= VEL_MAX ∧ acceleration >= -ACC_MAX ∧ acceleration <= ACC_MAX ∧ drag_coefficient >= 0.0 ∧ drag_coefficient <= DRAG_MAX) → (True) := sorry",
      "formal_eml_lang": null
    },
    "domain": "forge_mined",
    "lane": 2,
    "tags": [
      "forge_mined",
      "file::particle_euler_step",
      "function::velocity_step_with_drag",
      "chain_order::1",
      "class::exponential",
      "property::contract",
      "contract::euler_step_drag_decays_velocity"
    ]
  },
  "proofs": [],
  "difficulty": {
    "lane": 2,
    "label": "intermediate",
    "calibrated_from_attempts": 0,
    "average_hint_level_at_solve": 0.0,
    "prerequisite_skills": [
      "chain_order_definition",
      "exp_log_axioms",
      "hoare_contract_reasoning"
    ]
  },
  "common_mistakes": [],
  "tactic_trace": {
    "successful": {},
    "failed": {},
    "success_rate_by_tactic": {}
  },
  "structural_profile": {
    "chain_order": 1,
    "cost_class": null,
    "eml_depth": null,
    "dynamics": {
      "oscillations": 0,
      "decays": 1
    },
    "drift_risk": "LOW",
    "fpga_estimate": {
      "cycles": 8,
      "mac_units": 4,
      "trig_units": 0
    }
  },
  "relationships": {
    "parent": null,
    "siblings": [],
    "depends_on": [],
    "structural_siblings": []
  },
  "metadata": {
    "verified": false,
    "verification_method": "pending",
    "generated_by": "from_forge_importer_v1",
    "creation_date": "2026-05-01",
    "source_eml_file": "<private>/euler_step.eml",
    "source_function": "velocity_step_with_drag"
  }
}
