{
  "schema_version": "1.0.0",
  "theorem": {
    "id": "forge__mosfet_drain_current__triode_current__verify_contract",
    "base_id": "forge__mosfet_drain_current__triode_current__verify_contract",
    "variant_strategy": null,
    "statement": {
      "informal": "`triode_current` satisfies its @verify contract: under preconditions (transconductance_k >= K_MIN ∧ transconductance_k <= K_MAX ∧ vgs >= 0.0 ∧ vgs <= V_MAX ∧ vth >= VTH_MIN ∧ vth <= VTH_MAX ∧ vds >= 0.0 ∧ vds <= V_MAX), the function's result satisfies (result >= 0.0). This is the obligation Forge ships to a Lean target for DO-178C / IEC-61508 / ISO-26262 certification evidence.",
      "formal_lean": "-- @verify obligation pulled from mosfet_drain_current.eml\n-- theorem triode_current_linear_in_vds_at_low_vds : \\u2200 args, (transconductance_k >= K_MIN ∧ transconductance_k <= K_MAX ∧ vgs >= 0.0 ∧ vgs <= V_MAX ∧ vth >= VTH_MIN ∧ vth <= VTH_MAX ∧ vds >= 0.0 ∧ vds <= V_MAX) \\u2192 (result >= 0.0) := sorry",
      "formal_eml_lang": null
    },
    "domain": "forge_mined",
    "lane": 2,
    "tags": [
      "forge_mined",
      "file::mosfet_drain_current",
      "function::triode_current",
      "chain_order::0",
      "class::polynomial",
      "property::contract",
      "contract::triode_current_linear_in_vds_at_low_vds"
    ]
  },
  "proofs": [],
  "difficulty": {
    "lane": 2,
    "label": "beginner",
    "calibrated_from_attempts": 0,
    "average_hint_level_at_solve": 0.0,
    "prerequisite_skills": [
      "chain_order_definition",
      "hoare_contract_reasoning"
    ]
  },
  "common_mistakes": [],
  "tactic_trace": {
    "successful": {},
    "failed": {},
    "success_rate_by_tactic": {}
  },
  "structural_profile": {
    "chain_order": 0,
    "cost_class": null,
    "eml_depth": null,
    "dynamics": {
      "oscillations": 0,
      "decays": 0
    },
    "drift_risk": "LOW",
    "fpga_estimate": {
      "cycles": 14,
      "mac_units": 7,
      "trig_units": 0
    }
  },
  "relationships": {
    "parent": null,
    "siblings": [],
    "depends_on": [],
    "structural_siblings": []
  },
  "metadata": {
    "verified": false,
    "verification_method": "pending",
    "generated_by": "from_forge_importer_v1",
    "creation_date": "2026-05-01",
    "source_eml_file": "D:/monogate-forge/industries/semiconductor/mosfet_drain_current.eml",
    "source_function": "triode_current"
  }
}