{
  "schema_version": "1.0.0",
  "theorem": {
    "id": "forge__basel_capital__ima_total_capital__fpga_cycles",
    "base_id": "forge__basel_capital__ima_total_capital__fpga_cycles",
    "variant_strategy": null,
    "statement": {
      "informal": "`ima_total_capital` is implementable in 6 FPGA pipeline cycles using 3 MAC units (Forge's FPGA allocator estimate). This bounds the latency of the hardware-emitted Verilog.",
      "formal_lean": "-- theorem ima_total_capital_fpga_cycles : fpga_cycles ima_total_capital ≤ 6 := sorry",
      "formal_eml_lang": null
    },
    "domain": "forge_mined",
    "lane": 2,
    "tags": [
      "forge_mined",
      "file::basel_capital",
      "function::ima_total_capital",
      "chain_order::1",
      "class::exponential",
      "property::fpga_cycles"
    ]
  },
  "proofs": [],
  "difficulty": {
    "lane": 2,
    "label": "intermediate",
    "calibrated_from_attempts": 0,
    "average_hint_level_at_solve": 0.0,
    "prerequisite_skills": [
      "chain_order_definition",
      "exp_log_axioms"
    ]
  },
  "common_mistakes": [],
  "tactic_trace": {
    "successful": {},
    "failed": {},
    "success_rate_by_tactic": {}
  },
  "structural_profile": {
    "chain_order": 1,
    "cost_class": null,
    "eml_depth": null,
    "dynamics": {
      "oscillations": 0,
      "decays": 1
    },
    "drift_risk": "LOW",
    "fpga_estimate": {
      "cycles": 6,
      "mac_units": 3,
      "trig_units": 0
    }
  },
  "relationships": {
    "parent": null,
    "siblings": [],
    "depends_on": [],
    "structural_siblings": []
  },
  "metadata": {
    "verified": false,
    "verification_method": "pending",
    "generated_by": "from_forge_importer_v1",
    "creation_date": "2026-05-01",
    "source_eml_file": "D:/monogate-forge/industries/finance/risk/basel_capital.eml",
    "source_function": "ima_total_capital"
  }
}