{
  "schema_version": "1.0.0",
  "theorem": {
    "id": "expTree_depth",
    "base_id": "expTree_depth",
    "variant_strategy": null,
    "statement": {
      "informal": "The depth of `expTree` (the explicit `ceml(var, const 1)` representation of `exp(x)`) is exactly 1.",
      "formal_lean": "theorem expTree_depth : expTree.depth = 1 := by\n  simp [expTree, EMLTree.depth]",
      "formal_eml_lang": null
    },
    "domain": "eml",
    "lane": 1,
    "tags": [
      "depth",
      "exp",
      "witness",
      "lane-1"
    ]
  },
  "proofs": [
    {
      "id": "p1",
      "tactics": [
        "simp [expTree, EMLTree.depth]"
      ],
      "tactic_count": 1,
      "eml_node_cost": 1,
      "style": "definitional",
      "is_optimal": true,
      "discovered_by": "human",
      "discovery_date": "2026-04-26"
    }
  ],
  "difficulty": {
    "lane": 1,
    "label": "beginner",
    "calibrated_from_attempts": 0,
    "average_hint_level_at_solve": 0.0,
    "prerequisite_skills": [
      "depth_of_const",
      "depth_of_var"
    ]
  },
  "common_mistakes": [
    {
      "tactic": "(see why_fails)",
      "why_fails": "Trying just `rfl` — the recursion through `max` is not consistently reduced automatically and `rfl` may fail.",
      "frequency": 0
    },
    {
      "tactic": "(see why_fails)",
      "why_fails": "Writing `unfold expTree EMLTree.depth` works in some cases but leaves `1 + max 0 0 = 1` un-evaluated; `simp` finishes the arithmetic too.",
      "frequency": 0
    }
  ],
  "tactic_trace": {
    "successful": {},
    "failed": {},
    "success_rate_by_tactic": {}
  },
  "structural_profile": {
    "chain_order": null,
    "cost_class": "p1-d1-w0-c0",
    "eml_depth": null,
    "dynamics": {
      "oscillations": 0,
      "decays": 0
    },
    "drift_risk": "LOW",
    "fpga_estimate": null
  },
  "relationships": {
    "parent": null,
    "siblings": [],
    "depends_on": [
      "depth_of_const",
      "depth_of_var"
    ],
    "structural_siblings": [
      "exp_in_EML_one",
      "exp_isEMLElementary"
    ]
  },
  "metadata": {
    "verified": true,
    "verification_method": "lean4_kernel",
    "generated_by": "from_petal_importer_v1",
    "creation_date": "2026-04-26"
  }
}