{
  "schema_version": "1.0.0",
  "theorem": {
    "id": "forge__magnetometer_heading__true_heading__node_count",
    "base_id": "forge__magnetometer_heading__true_heading__node_count",
    "variant_strategy": null,
    "statement": {
      "informal": "`true_heading` compiles to 4 EML routing nodes after SuperBEST optimization. This is the canonical, minimal node count Forge produces for the function as written.",
      "formal_lean": "-- Pending MachLib infrastructure for forge function imports.\n-- theorem true_heading_node_count : node_count true_heading = 4 := sorry",
      "formal_eml_lang": null
    },
    "domain": "forge_mined",
    "lane": 2,
    "tags": [
      "forge_mined",
      "file::magnetometer_heading",
      "function::true_heading",
      "chain_order::0",
      "class::polynomial",
      "property::node_count"
    ]
  },
  "proofs": [],
  "difficulty": {
    "lane": 2,
    "label": "beginner",
    "calibrated_from_attempts": 0,
    "average_hint_level_at_solve": 0.0,
    "prerequisite_skills": [
      "chain_order_definition"
    ]
  },
  "common_mistakes": [],
  "tactic_trace": {
    "successful": {},
    "failed": {},
    "success_rate_by_tactic": {}
  },
  "structural_profile": {
    "chain_order": 0,
    "cost_class": null,
    "eml_depth": null,
    "dynamics": {
      "oscillations": 0,
      "decays": 0
    },
    "drift_risk": "LOW",
    "fpga_estimate": {
      "cycles": 2,
      "mac_units": 1,
      "trig_units": 0
    }
  },
  "relationships": {
    "parent": null,
    "siblings": [],
    "depends_on": [],
    "structural_siblings": []
  },
  "metadata": {
    "verified": false,
    "verification_method": "pending",
    "generated_by": "from_forge_importer_v1",
    "creation_date": "2026-05-01",
    "source_eml_file": "<private>/magnetometer_heading.eml",
    "source_function": "true_heading"
  }
}
