{
  "schema_version": "1.0.0",
  "theorem": {
    "id": "gamma_nat_eq_factorial_constant_swap_0",
    "base_id": "gamma_nat_eq_factorial",
    "variant_strategy": "constant_swap",
    "statement": {
      "informal": "Γ(n+1) = n! for natural n. The bridge between the Gamma function and the factorial — fixes Γ on the positive integers. (with constant 1 promoted to a parameter k0)",
      "formal_lean": "theorem gamma_nat_eq_factorial (k0 : ℕ) (n : ℕ) : Gamma (n + k0) = n.factorial",
      "formal_eml_lang": null
    },
    "domain": "eml",
    "lane": 5,
    "tags": [
      "constant_swap",
      "generated",
      "lane-5"
    ]
  },
  "proofs": [
    {
      "id": "p1",
      "tactics": [
        "theorem gamma_nat_eq_factorial (n : ℕ) : Gamma (n + 1) = n.factorial := Real.Gamma_nat_eq_factorial n"
      ],
      "tactic_count": 1,
      "eml_node_cost": 0,
      "style": "definitional",
      "is_optimal": true,
      "discovered_by": "machlib_generator_v1",
      "discovery_date": "2026-04-30"
    }
  ],
  "difficulty": {
    "lane": 5,
    "label": "expert",
    "calibrated_from_attempts": 0,
    "average_hint_level_at_solve": 0.0,
    "prerequisite_skills": []
  },
  "common_mistakes": [],
  "tactic_trace": {
    "successful": {},
    "failed": {},
    "success_rate_by_tactic": {}
  },
  "structural_profile": {
    "chain_order": null,
    "cost_class": null,
    "eml_depth": null,
    "dynamics": {
      "oscillations": 0,
      "decays": 0
    },
    "drift_risk": "LOW",
    "fpga_estimate": null
  },
  "relationships": {
    "parent": "gamma_nat_eq_factorial",
    "siblings": [],
    "depends_on": [],
    "structural_siblings": []
  },
  "metadata": {
    "verified": false,
    "verification_method": null,
    "verification_pending": "Phase 1.5 — port legacy theorems to MachLib foundations before kernel re-verification.",
    "generated_by": "machlib_generator_v1",
    "creation_date": "2026-04-30"
  }
}